{
  "version": "0.18.0",
  "owner": "agent-cluster-contracts",
  "concepts": [
    {
      "name": "Decision",
      "kind": "artifact",
      "owner": "agent-cluster-contracts",
      "description": "A recorded decision under decisions/YYYY/MM/DD/<id>.decision.riido.json. Conforms to decisions/schema.riido.json.",
      "examples": ["001-initial-agreement"],
      "decision": "001-initial-agreement"
    },
    {
      "name": "ConceptMap",
      "kind": "artifact",
      "owner": "agent-cluster-contracts",
      "description": "This file. Captures relationships and prose constraints that DSL cannot yet express.",
      "examples": ["concept-map/concept-map.riido.json"],
      "decision": "001-initial-agreement"
    },
    {
      "name": "SsotDependencyMap",
      "kind": "artifact",
      "owner": "agent-cluster-contracts",
      "description": "Declares which repos consume which SSOT artifacts and which generated artifacts depend on which sources. Used by tools/ssotdeps verify.",
      "examples": ["ssot-dependency-map.riido.json"],
      "decision": "001-initial-agreement"
    },
    {
      "name": "DevPatternEvent",
      "kind": "event",
      "owner": "agent-cluster-contracts",
      "description": "Recorded selection of top_down vs bottom_up for a work item, written as JSONL by tools/devpattern.",
      "examples": ["{\"work_item\":\"WI-001\",\"source\":\"top_down\",\"at\":\"2026-06-03T...\"}"],
      "decision": "001-initial-agreement"
    },
    {
      "name": "WorkItem",
      "kind": "aggregate",
      "owner": "agent-cluster-contracts",
      "description": "Unit of work an agent picks up. SSOT is dsl/domain/work-item.lisp; emitted to ir/domain/work-item.ir.json; consumed by backend and frontend through generated clients (never re-declared).",
      "examples": ["{\"id\":\"WI-001\",\"title\":\"Bootstrap contracts repo\",\"state\":\"done\"}"],
      "decision": "003-first-vertical-slice"
    },
    {
      "name": "WorkItemCreated",
      "kind": "event",
      "owner": "agent-cluster-contracts",
      "description": "Emitted when a new WorkItem appears. SSOT is dsl/domain/work-item-created.lisp; emitted to ir/domain/work-item-created.ir.json. Backend SSE endpoint /events emits this as its only event type in decision 003's scope.",
      "examples": ["{\"work_item_id\":\"WI-001\",\"title\":\"Bootstrap contracts repo\"}"],
      "decision": "003-first-vertical-slice"
    },
    {
      "name": "GeneratedClient",
      "kind": "artifact",
      "owner": "agent-cluster-contracts",
      "description": "Per-language consumer-side files emitted from IR by tools/gen-go-client and tools/gen-dart-client. Committed into the consumer repo; never edited by hand; drift detected by per-repo CI gates.",
      "examples": ["backend/internal/contracts/work_item.go", "frontend/lib/contracts_client/work_item.dart"],
      "decision": "003-first-vertical-slice"
    },
    {
      "name": "ProbeBaseline",
      "kind": "process",
      "owner": "agent-cluster-contracts",
      "description": "Output of `probe preflight`: the aggregate green/red state of every contracts-local verifier (decision validate, ssotdeps verify --mode local, conceptmap verify, secretscan, irdrift). status=candidate_allowed means the dumb-agent may create one candidate; status=baseline_blocked means stop.",
      "examples": ["{\"status\":\"candidate_allowed\",\"candidate_allowed\":true,\"next_allowed_action\":\"create-candidate\"}"],
      "decision": "005-dumb-agent-probe-baseline-and-fixture-verifier"
    },
    {
      "name": "EnvironmentBlocker",
      "kind": "artifact",
      "owner": "agent-cluster-contracts",
      "description": "A reports/environment-blockers/<id>.md note describing an environment or setup issue (missing tool, broken baseline, missing sibling artifact). Filed by dumb-agent under a red baseline as the only allowed write. NOT a domain guard gap.",
      "examples": ["reports/environment-blockers/eb-001-sbcl-missing.md"],
      "decision": "005-dumb-agent-probe-baseline-and-fixture-verifier"
    },
    {
      "name": "Fixture",
      "kind": "artifact",
      "owner": "agent-cluster-contracts",
      "description": "A .json file under fixtures/positive/ or fixtures/negative/ with a .meta.json sidecar declaring fixture_type, expected (pass|fail), and optionally expected_error_contains. Walked by `probe fixtures`. v1 supports fixture_type=decision only.",
      "examples": ["fixtures/positive/decision/min.json + min.meta.json"],
      "decision": "005-dumb-agent-probe-baseline-and-fixture-verifier"
    },
    {
      "name": "GraphQLQuery",
      "kind": "process",
      "owner": "agent-cluster-contracts",
      "description": "Read-only GraphQL field defined by defquery in DSL. Its wire-name and returns-shape are SSOT; backend resolvers and frontend clients reference them via generated constants (Go: <Name>QueryName + <Name>Result; Dart: <camelName>QueryName). The hand-written GraphQL parser+executor remains hand-written until a separate library decision.",
      "examples": ["defquery list-work-items :wire-name \"workItems\" :returns-list work-item"],
      "decision": "006-ssot-extension-graphql-via-dsl"
    },
    {
      "name": "IRSchema",
      "kind": "artifact",
      "owner": "agent-cluster-contracts",
      "description": "JSON Schema (ir/schema/ir.schema.json) describing the structural shape of every ir/domain/<name>.ir.json document. Decision 007 added this; before then, C-002 referenced a schema that didn't exist. probe fixtures mirrors these rules in Go (no third-party validator dep) so fixture_type=ir-aggregate / ir-event / query can be checked.",
      "examples": ["ir/schema/ir.schema.json", "fixtures/positive/work-item/min.json with fixture_type ir-aggregate"],
      "decision": "007-agent-roles-glob-fix-and-ir-schema-and-ir-fixture-types"
    },
    {
      "name": "MergeAuthority",
      "kind": "policy",
      "owner": "agent-cluster-contracts",
      "description": "Bounded merge grant attached to a role (currently only dumb-agent). agentguard merge-check decides merge_allowed iff every changed file matches auto_merge_paths, none matches forbidden_paths, file count <= max_files_per_pr. Stricter than write-time agentguard verify which uses allowed_paths.",
      "examples": ["dumb-agent merge_authority.granted=true with auto_merge_paths covering fixtures/positive, fixtures/negative, fuzz/corpus, reports/guard-candidates, reports/environment-blockers"],
      "decision": "010-dumb-agent-bounded-merge-authority"
    }
  ],
  "relationships": [
    {
      "from": "Decision",
      "kind": "owns",
      "to": "ConceptMap",
      "example": "001-initial-agreement introduced the concept-map artifact and its schema.",
      "decision": "001-initial-agreement"
    },
    {
      "from": "ConceptMap",
      "kind": "references",
      "to": "Decision",
      "example": "Each concept/relationship/constraint optionally cites the decision that introduced it.",
      "decision": "001-initial-agreement"
    },
    {
      "from": "SsotDependencyMap",
      "kind": "constrains",
      "to": "Decision",
      "example": "A decision claiming generated_artifacts must list a source whose path is declared in ssot-dependency-map.riido.json.",
      "decision": "001-initial-agreement"
    },
    {
      "from": "WorkItem",
      "kind": "emits",
      "to": "WorkItemCreated",
      "example": "Creating a new WorkItem emits one WorkItemCreated event on the backend SSE surface.",
      "decision": "003-first-vertical-slice"
    },
    {
      "from": "GeneratedClient",
      "kind": "implements",
      "to": "WorkItem",
      "example": "backend/internal/contracts/work_item.go is the Go representation of ir/domain/work-item.ir.json; frontend/lib/contracts_client/work_item.dart is the Dart representation.",
      "decision": "003-first-vertical-slice"
    },
    {
      "from": "ProbeBaseline",
      "kind": "constrains",
      "to": "Fixture",
      "example": "If ProbeBaseline.status is baseline_blocked, no new Fixture (positive, negative, or fuzz) may be created in that PR. Only one EnvironmentBlocker may be filed.",
      "decision": "005-dumb-agent-probe-baseline-and-fixture-verifier"
    },
    {
      "from": "EnvironmentBlocker",
      "kind": "references",
      "to": "ProbeBaseline",
      "example": "Every environment-blocker report cites the probe preflight output that justified filing it.",
      "decision": "005-dumb-agent-probe-baseline-and-fixture-verifier"
    },
    {
      "from": "GraphQLQuery",
      "kind": "references",
      "to": "WorkItem",
      "example": "list-work-items returns a list of WorkItem; the returns.type in IR points to the aggregate kebab-name.",
      "decision": "006-ssot-extension-graphql-via-dsl"
    },
    {
      "from": "GeneratedClient",
      "kind": "implements",
      "to": "GraphQLQuery",
      "example": "backend/internal/contracts/list_work_items.go exposes ListWorkItemsQueryName and ListWorkItemsResult; frontend/lib/contracts_client/list_work_items.dart exposes listWorkItemsQueryName.",
      "decision": "006-ssot-extension-graphql-via-dsl"
    }
  ],
  "constraints": [
    {
      "id": "C-001",
      "rule": "No repo other than agent-cluster-contracts may define a domain vocabulary term (aggregate, entity, value-object, event, policy, lifecycle state, view).",
      "rationale": "Vocabulary is the SSOT for cross-repo communication. If backend or frontend defines its own, the same concept ends up with two names and contracts drift silently.",
      "examples": [
        "backend writes `type WorkItem struct {...}` imported from generated code emitted by ir/domain/work-item.ir.json — OK.",
        "frontend reads `WorkItemView` from the generated client — OK."
      ],
      "counterexamples": [
        "backend declares `type Task struct {...}` ad-hoc to mean what contracts calls WorkItem — NOT OK.",